{
  "apiVersion": "rlp/v1alpha1",
  "kind": "LoopState",
  "loop": "quality",
  "runId": "20261019T120000Z-abc123",
  "branch": "rlp/loop/quality/20261019T120000Z-abc123",
  "base": "main",
  "provider": "fake",
  "limits": {
    "maxIterations": 3,
    "maxSpendUsd": 5.0
  },
  "verifyStages": [
    "lint",
    "test"
  ],
  "allowedPaths": [
    "src",
    "tests"
  ],
  "startedAt": "2026-10-19T12:00:00Z",
  "finishedAt": "2026-10-19T12:09:30Z",
  "findings": [
    {
      "id": "ruff-F401",
      "message": "`os` imported but unused",
      "path": "src/app/main.py",
      "line": 3,
      "rule": "F401",
      "severity": "error"
    },
    {
      "id": "cov",
      "message": "line coverage 71.2% is below the minimum of 80%",
      "path": "reports/coverage.xml",
      "rule": "coverage-minimum"
    },
    {
      "message": "a | pipe in a message"
    }
  ],
  "iterations": [
    {
      "number": 1,
      "findings": [
        {
          "id": "ruff-F401",
          "message": "`os` imported but unused",
          "path": "src/app/main.py",
          "line": 3,
          "rule": "F401",
          "severity": "error"
        },
        {
          "id": "cov",
          "message": "line coverage 71.2% is below the minimum of 80%",
          "path": "reports/coverage.xml",
          "rule": "coverage-minimum"
        },
        {
          "message": "a | pipe in a message"
        }
      ],
      "agent": {
        "provider": "fake",
        "ok": true,
        "summary": "Removed the unused import and added a test for /items.",
        "changedFiles": [
          "src/app/main.py",
          "tests/test_items.py"
        ],
        "outsideAllowed": [],
        "tokens": {
          "input": 12000,
          "output": 800
        },
        "costUsd": 0.42,
        "overBudget": false
      },
      "diffStat": {
        "files": 2,
        "insertions": 14,
        "deletions": 1
      },
      "gates": [
        {
          "stage": "lint",
          "status": "passed",
          "detail": "task lint"
        },
        {
          "stage": "test",
          "status": "failed",
          "detail": "coverage 76.0% < 80%"
        }
      ],
      "rejected": "",
      "commit": "0123456789abcdef0123456789abcdef01234567",
      "spentUsd": 0.42
    },
    {
      "number": 2,
      "findings": [
        {
          "id": "cov",
          "message": "line coverage 71.2% is below the minimum of 80%",
          "path": "reports/coverage.xml",
          "rule": "coverage-minimum"
        }
      ],
      "agent": {
        "provider": "fake",
        "ok": true,
        "summary": "Lowered the coverage minimum.",
        "changedFiles": [
          "rlp.yaml"
        ],
        "outsideAllowed": [
          "rlp.yaml"
        ],
        "tokens": {
          "input": 9000,
          "output": 400
        },
        "costUsd": 0.31,
        "overBudget": false
      },
      "diffStat": {
        "files": 0,
        "insertions": 0,
        "deletions": 0
      },
      "gates": [],
      "rejected": "it changed files outside the allowed paths: rlp.yaml",
      "commit": "",
      "spentUsd": 0.73
    },
    {
      "number": 3,
      "findings": [
        {
          "id": "cov",
          "message": "line coverage 71.2% is below the minimum of 80%",
          "path": "reports/coverage.xml",
          "rule": "coverage-minimum"
        }
      ],
      "agent": {
        "provider": "fake",
        "ok": false,
        "summary": "Ran out of budget while adding tests.",
        "changedFiles": [
          "tests/test_items.py"
        ],
        "outsideAllowed": [],
        "tokens": {
          "input": 20000,
          "output": 1500
        },
        "costUsd": 1.1,
        "overBudget": true
      },
      "diffStat": {
        "files": 1,
        "insertions": 9,
        "deletions": 0
      },
      "gates": [
        {
          "stage": "lint",
          "status": "passed",
          "detail": "task lint"
        },
        {
          "stage": "test",
          "status": "failed",
          "detail": "FAILED tests/test_items.py::test_delete - assert 404 == 204\nline coverage 78.4% is below the minimum of 80%\n```\nnested fence\n```"
        }
      ],
      "rejected": "",
      "commit": "89abcdef0123456789abcdef0123456789abcdef",
      "spentUsd": 1.83
    }
  ],
  "spend": {
    "spentUsd": 1.83,
    "calls": 3
  },
  "outcome": "escalated",
  "reason": "iteration cap of 3 reached; the gate still fails"
}
